Title,Company,Project Type,Location,Contract Value,Date Published,Source URL,Description
RBM Infracon Rises After Securing Multiple High-Value Contracts,RBM Infracon,Infrastructure,India,Rs 114 billion,2025-02-19,https://www.google.com/search?q=latest oil and gas pipeline project+contract+win+india&tbm=nws&tbs=qdr:m,RBM Infracon's share price surged 3.45% to Rs 333 following the announcement that it has secured multiple contracts worth a total of Rs 114 billion.
NLC India Wins Contract To Develop 200 MW Wind Power Project From SJVN,NLC India Ltd,Wind Power Project,India,,2025-03-03,https://www.google.com/search?q=latest oil and gas pipeline project+contract+win+india&tbm=nws&tbs=qdr:m,State-owned NLC India Ltd on Saturday said it has bagged a contract from SJVN Ltd to develop and operate a 200 MW wind power project.
NLC India secures contract of 200 MW wind power project from SJVN,NLC India Ltd (NLCIL),Wind power project,India,,2025-03-01,https://www.google.com/search?q=latest wind energy contract wins+contract+win+india&tbm=nws&tbs=qdr:m,NLC India Ltd has bagged a contract from SJVN Ltd to develop and operate a 200 MW wind power project.
Suzlon Secures 204.75 MW Wind Order from Jindal Green Wind 1,Suzlon Energy,Wind energy,India,,2025-03-04,https://www.google.com/search?q=latest wind energy contract wins+contract+win+india&tbm=nws&tbs=qdr:m,"Suzlon Energy secures a 204.75 MW wind order from Jindal Green Wind 1, expanding its C&I portfolio to 907.20 MW and supporting India's green energy."
"SJVN Awards 448 MW Renewable Energy Projects To ReNew, Tata Power, EG Energy, And Others","ReNew, Tata Power, EG Energy",Renewable energy,India,,2025-03-01,https://www.google.com/search?q=latest wind energy contract wins+contract+win+india&tbm=nws&tbs=qdr:m,"SJVN concludes a 1.2 GW renewable energy auction, awarding 448 MW to ReNew, Tata Power, and others at competitive tariffs."
TP Solar to deliver Rs 632 Cr worth of solar modules to SECI,TP Solar,Solar Module Manufacturing,India,Rs 632 crore,2025-03-04,https://www.google.com/search?q=latest wind energy contract wins+contract+win+india&tbm=nws&tbs=qdr:m,"TP Solar, which is the solar manufacturing division of Tata Power, has won a Rs 632 crore contract from the Solar Energy Corporation of India (SECI)."
Tata Power Solar Wins ₹632 Cr SECI Contract To Supply 292.5 MWp Solar Modules,Tata Power Solar,Solar Module Supply,India,₹632 Cr,2025-03-01,https://www.google.com/search?q=latest wind energy contract wins+contract+win+india&tbm=nws&tbs=qdr:m,"TP Solar Limited a subsidiary of Tata Power Renewable Energy, has secured a contract from the SECI to supply 292.5 MWp DCR Solar Modules."
New Hybrid-Electric SOV for EnBW’s He Dreiht Offshore Wind Farm Enters Construction,Cochin Shipyard,Offshore Wind Farm Service Vessel,India,,2025-02-26,https://www.google.com/search?q=latest wind energy contract wins+contract+win+india&tbm=nws&tbs=qdr:m,"Cochin Shipyard has started building a hybrid-electric service operations vessel (SOV) for North Star, which will operate at the He Dreiht offshore wind farm."
